{
  "$schema": "https://json-schema.org/draft/2020-12/schema",
  "$id": "urn:unit-test-ide:coverage:v1",
  "title": "CoverageDocumentV1",
  "type": "object",
  "additionalProperties": false,
  "required": ["schemaVersion", "provenance", "completeness", "summary", "files"],
  "properties": {
    "schemaVersion": { "const": "1.0" },
    "provenance": { "$ref": "#/$defs/provenance" },
    "completeness": { "$ref": "#/$defs/completeness" },
    "summary": { "$ref": "#/$defs/summary" },
    "files": {
      "type": "array",
      "maxItems": 100000,
      "items": { "$ref": "#/$defs/file" }
    }
  },
  "$defs": {
    "compiler": {
      "title": "CoverageCompilerV1",
      "type": "object",
      "additionalProperties": false,
      "required": ["family", "version"],
      "properties": {
        "family": { "enum": ["gcc", "clang", "clang-cl"] },
        "version": { "type": "string", "minLength": 1, "maxLength": 128, "pattern": "^[^\\x00]+$" }
      }
    },
    "driver": {
      "title": "CoverageDriverV1",
      "type": "object",
      "additionalProperties": false,
      "required": ["name", "version"],
      "properties": {
        "name": { "enum": ["gcov", "llvm-cov"] },
        "version": { "type": "string", "minLength": 1, "maxLength": 128, "pattern": "^[^\\x00]+$" }
      }
    },
    "collector": {
      "title": "CoverageCollectorV1",
      "type": "object",
      "additionalProperties": false,
      "required": ["name", "version"],
      "properties": {
        "name": { "enum": ["gcovr", "llvm-cov"] },
        "version": { "type": "string", "minLength": 1, "maxLength": 128, "pattern": "^[^\\x00]+$" }
      }
    },
    "provenance": {
      "title": "CoverageProvenanceV1",
      "type": "object",
      "additionalProperties": false,
      "required": [
        "platform", "architecture", "compiler", "driver", "collector",
        "normalizerVersion", "instrumentationFingerprint"
      ],
      "properties": {
        "platform": { "enum": ["windows", "linux"] },
        "architecture": { "enum": ["x86", "x64", "arm64"] },
        "compiler": { "$ref": "#/$defs/compiler" },
        "driver": { "$ref": "#/$defs/driver" },
        "collector": { "$ref": "#/$defs/collector" },
        "normalizerVersion": {
          "type": "string", "minLength": 1, "maxLength": 128, "pattern": "^[^\\x00]+$"
        },
        "instrumentationFingerprint": { "type": "string", "pattern": "^[0-9a-f]{64}$" }
      }
    },
    "completeness": {
      "title": "CoverageCompletenessV1",
      "type": "object",
      "additionalProperties": false,
      "required": ["outcome", "reasons"],
      "properties": {
        "outcome": { "enum": ["available", "partial"] },
        "reasons": {
          "type": "array",
          "maxItems": 64,
          "uniqueItems": true,
          "items": {
            "enum": ["test_crashed", "test_timed_out", "profile_missing_for_failed_invocation"]
          }
        }
      }
    },
    "metric": {
      "title": "CoverageMetricV1",
      "type": "object",
      "additionalProperties": false,
      "required": ["covered", "total"],
      "properties": {
        "covered": { "type": "integer", "minimum": 0, "maximum": 9007199254740991 },
        "total": { "type": "integer", "minimum": 0, "maximum": 9007199254740991 }
      }
    },
    "summary": {
      "title": "CoverageSummaryV1",
      "type": "object",
      "additionalProperties": false,
      "required": ["lines", "branches", "functions"],
      "properties": {
        "lines": { "$ref": "#/$defs/metric" },
        "branches": { "$ref": "#/$defs/metric" },
        "functions": { "$ref": "#/$defs/metric" }
      }
    },
    "line": {
      "title": "CoverageLineV1",
      "type": "object",
      "additionalProperties": false,
      "required": ["line", "count", "branches"],
      "properties": {
        "line": { "type": "integer", "minimum": 1, "maximum": 9007199254740991 },
        "count": { "type": "integer", "minimum": 0, "maximum": 9007199254740991 },
        "branches": { "$ref": "#/$defs/metric" }
      }
    },
    "file": {
      "title": "CoverageFileV1",
      "type": "object",
      "additionalProperties": false,
      "required": ["uri", "sha256", "summary", "lines"],
      "properties": {
        "uri": {
          "type": "string",
          "minLength": 1,
          "maxLength": 4096,
          "pattern": "^(?!/)(?![A-Za-z]:)(?![A-Za-z][A-Za-z0-9+.-]*:)(?!.*[\\\\?#\\x00]).+$"
        },
        "sha256": { "type": "string", "pattern": "^[0-9a-f]{64}$" },
        "summary": { "$ref": "#/$defs/summary" },
        "lines": {
          "type": "array",
          "maxItems": 1000000,
          "items": { "$ref": "#/$defs/line" }
        }
      }
    }
  }
}
