{"completeness":{"outcome":"available","reasons":[]},"files":[{"lines":[{"branches":{"covered":1,"total":2},"count":1,"line":10},{"branches":{"covered":0,"total":0},"count":0,"line":11}],"sha256":"b6a98d9ce9a2d9149288fa3df42d377c3e42737afdcdaf714e33c0a100b51060","summary":{"branches":{"covered":1,"total":2},"functions":{"covered":1,"total":1},"lines":{"covered":1,"total":2}},"uri":"src/a.cpp"},{"lines":[{"branches":{"covered":0,"total":0},"count":2,"line":2}],"sha256":"2088d0c4b41022d90f663fa8d8156cb525241b55d30ecdf922c38f94f7efda4c","summary":{"branches":{"covered":0,"total":0},"functions":{"covered":0,"total":1},"lines":{"covered":1,"total":1}},"uri":"src/z.cpp"}],"provenance":{"architecture":"x64","collector":{"name":"llvm-cov","version":"18.1.8"},"compiler":{"family":"clang-cl","version":"18.1.8"},"driver":{"name":"llvm-cov","version":"18.1.8"},"instrumentationFingerprint":"aaaaaaaaaaaaaaaaaaaaaaaaaaaaaaaaaaaaaaaaaaaaaaaaaaaaaaaaaaaaaaaa","normalizerVersion":"1.0.0","platform":"windows"},"schemaVersion":"1.0","summary":{"branches":{"covered":1,"total":2},"functions":{"covered":1,"total":2},"lines":{"covered":2,"total":3}}}
